start	end	text
2414240	2417180	The dot locks the reality of the letter into place,
2417280	2419800	just like the word wooden locks the reality of the box.
2420160	2421860	And we can push the parallel further.
2422720	2426820	Arabic writing also utilizes optional vowel markings, the hanakat,
2427380	2430560	which are often omitted entirely in fluent texts.
2431260	2433840	These markings provide grammatical context and nuance,
2434180	2436780	but they do not alter the fundamental identity of the consonant.
2437020	2437660	They're optional.
2437880	2438060	Right.
2438060	2443300	These optional vowels operate exactly like the outer-orbit adjectives' opinion and size.
2443900	2444700	They add flavor.
2445140	2446140	They add context.
2446580	2448700	But they are pushed to the visual periphery.
2449160	2452480	They are less persistent and therefore more easily discarded
2452480	2454500	when processing speed is paramount.
2454660	2459080	The visual script and the spoken grammar are running the exact same compression algorithm.
2459600	2461360	Lock the core identity in the center.
2461960	2464500	Weld the high leverage modifiers directly to it.
2464620	2467720	Push the low-value contextual noise to the fringes.
2467720	2471700	But the connection to the Arabic-speaking world doesn't end with typography.
2472220	2474560	The most profound revelation in the entire paper
2474560	2478780	occurs when Flixton shifts from visual architecture to cultural metaphysics.
2479140	2483020	Because if the Arabic script is visually engineering this exact efficiency,
2483400	2485700	how did the culture conceptualize it intellectually?
2486140	2490140	This leads us to the final, most astounding layer of the source material.
2490920	2495600	The paper includes an extended analysis provided by a native Egyptian Arabic speaker,
2495600	2498640	reflecting on the mechanics of the English adjective chart.
2498860	2499080	Okay.
2499320	2503000	Now, structurally, Arabic syntax operates differently than English.
2503540	2507900	Instead of placing adjectives before the noun, Arabic typically places them after.
2508180	2512720	So instead of the wooden table, the literal translation is closer to the table, the wooden.
2512720	2518980	But the sequence itself, the order in which the adjectives are stacked as they trail away from the noun perfectly,
2519500	2522300	mirrors the English persistence hierarchy in reverse.
2522940	2526200	The properties with the highest persistence remain closest to the noun,
2526480	2529560	and the subjective opinions trail off at the very end.
2529560	2529920	Yes.
2530280	2531800	The spatial dynamic holds true.
2532300	2536840	But what is truly revelatory is not the syntax, but the morphological transparency of the language.
2537460	2543640	The specific vocabulary this Egyptian speaker instinctively used to describe why the sequence works this way.
2543680	2544300	What did they say?
2544600	2549240	They didn't rely on the sterile, descriptive jargon of modern linguistics.
2549520	2551880	They didn't talk about slots or modifiers.
2551880	2556360	They stated that the order is determined by, and I quote the translation directly,
2556760	2560600	the degree of the adjective's attachment to the identity of the thing.
2560760	2562120	Attachment to the identity.
2562520	2562960	Wow.
2563180	2567980	That immediately elevates the conversation from grammar to ontology.
2568520	2570580	We are no longer talking about words.
2570660	2572520	We are talking about the nature of being.
2572680	2573540	It goes even deeper.
2574240	2580020	Arabic grammar possesses specific structural constructions that explicitly formalize this divide.
2580020	2586300	It contains possessive frameworks that literally tether subjective opinions like beauty directly to the observer,
2586660	2591540	while tethering constitutive properties like material directly to the object.
2591660	2592440	That's fascinating.
2592460	2596240	It forces the speaker to grammatically sever the subjective from the objective.
2596620	2601380	But the true seismic shock of the paper rests on a single word used in the explanation.
2601900	2606460	When attempting to describe the immutable core of the object, the noun at the center of the hierarchy,
2606940	2608860	the Arabic term deployed was jawar.
2609000	2609480	Jawar.
2609480	2611320	I can sense the weight of that word.
2611660	2613520	What is the historical payload attached to it?
2613840	2618820	To understand the weight of jawar, we have to step back into the golden age of Islamic philosophy.
2619900	2625620	During the 9th and 10th centuries, scholars like al-Farabi and later Ibn Sina Avicenna in the West
2625620	2632120	were engaged in a monumental project to translate, refine, and expand upon the metaphysical works of Aristotle.
2632240	2632600	Right.
2632600	2638840	Aristotle's foundational theory of existence proposed that the universe is divided into two fundamental categories.
2639060	2643920	The first is substance, the underlying, essential, unchanging reality of a thing.
2644240	2650740	The second is accident, the temporary, contingent, non-essential properties that adhere to the substance.
2650740	2652880	So a human being is a substance.
2652880	2656840	Being sunburned or being tired or being young, those are just accidents.
2657180	2660160	They happen to the substance, but they don't define its fundamental nature.
2660520	2660880	Precisely.
2661120	2664520	And when the Islamic philosophers synthesized this metaphysical framework,
2664520	2670580	the precise technical term they selected for Aristotle's substance, the immutable core, was jawar.
2670880	2675420	And the term they used for the accident, the temporary peripheral property, was karad.
2675600	2679720	Substance and accident, jawar and karad, inner orbit and outer orbit.
2680040	2684860	They dedicated their lives to constructing staggeringly complex philosophical treatises,
2685380	2689560	exploring the boundaries between the essential jawar and the contingent karin.
2689560	2693160	It was the bleeding edge of intellectual inquiry for centuries.
2693160	2695820	The irony here is almost difficult to process.
2696340	2698640	Picture a modern, brightly lit classroom.
2699380	2703980	An exhausted ESL teacher is standing at a whiteboard, drawing an 11-slot grid,
2704200	2707320	meticulously explaining to a room full of adult students that
2707320	2712020	opinion must precede size and origin must precede material.
2712160	2713280	Yeah, we've all been in that room.
2713440	2717660	The teacher believes they are dispensing a quirky, arbitrary rule of English syntax.
2717660	2725020	But in reality, what is happening on that whiteboard is a pedagogical rediscovery of medieval Islamic metaphysics.
2725400	2726380	It is exactly that.
2726480	2732040	The English adjective sequence is an unconscious mathematical formalization of the exact metaphysical distinction
2732040	2734940	that Aristotle, Al-Farabi, and Ibn Sina theorized.
2735000	2736020	That's just wild.
2736020	2739220	Every single time a human being fluently utters the phrase,
2739600	2745300	a small red wooden box, their brain is rigorously executing Aristotelian substance theory.
2746020	2753420	We are effortlessly sorting the physical universe into essential jawar and temporary karin at conversational speed
2753420	2756700	without ever realizing the philosophical depth of the computation.
2757040	2759560	It fundamentally changes how you view language.
2760000	2763760	We aren't just communicating, we are philosophizing at blinding speeds.
2763760	2767680	And if this sorting algorithm is truly rooted in universal physics,
2768020	2770520	cognitive processing limits, and ancient metaphysics,
2770740	2774020	then Flyxion's ultimate conclusion must be correct.
2774500	2776320	This cannot be an isolated phenomenon.
2776720	2778480	It must be a global imperative.
2779000	2782040	The paper closes by establishing this as a universal framework,
2782440	2784600	making definitive cross-linguistic predictions.
2785260	2788900	It states that if navigational pressure is the true engine of lexical preservation,
2789300	2791040	we will find its fingerprints everywhere.
2791180	2791520	Everywhere.
2791520	2795520	For example, in languages that boast completely flexible word orders,
2796480	2800500	languages where speakers are technically permitted to scramble adjectives in any configuration
2800500	2802660	without breaking grammatical rules,
2803160	2806440	the theory predicts that in neutral, low-stress contexts,
2806960	2810900	the speakers will still unconsciously default to the persistence hierarchy.
2811560	2815900	The gravitational pull of physical reality will overpower syntactical freedom.
2815900	2820720	The brain will naturally put the material closer to the noun than the opinion,
2821260	2825140	simply because the brain recognizes the material is more important to survival.
2825760	2831060	What about languages that bypass adjectives altogether and use entirely different categorizing technologies?
2831060	2834800	Look at languages with robust nominal classifier systems.
2835100	2836720	Mandarin, Japanese, Burmese.
2837160	2841780	These systems require a specific categorizing word to accompany a noun based on its features.
2842200	2846120	The persistence hierarchy predicts exactly which features will dominate those systems.
2846280	2847660	Let me guess, inner-orbit stuff.
2847660	2854420	And indeed, cross-linguistic analysis reveals that nominal classifiers overwhelmingly organize the world
2854420	2859100	based on material and shape, the deep, inner-orbit constitutive properties.
2859660	2865620	They almost never classify objects based on opinion or size, the flimsy outer-orbit accidents.
2865620	2870580	English spatial sequences, Spanish verb toggles, and Mandarin nominal classifiers.
2870960	2876820	They're all just different technological solutions engineered by human cultures to solve the exact same physics problem.
2877180	2883400	How do we highlight the structural reality of the object to ensure we can accurately navigate our future interactions with it?
2883760	2889080	This is the grand unification proposed by the text, the reachability theory of lexical preservation.
2889080	2897080	It argues that linguistic structures do not survive through centuries of cultural evolution because they are poetic or culturally significant.
2897280	2898780	They survive because they're useful.
2898940	2901680	They survive because they are vital tools for physical survival.
2902220	2908380	Language relentlessly prioritizes high stakes, future dictating reality over subjective, ephemeral opinion.
2908900	2912640	It places the heavy, world-altering facts at the impregnable center of our grammar
2912640	2916200	and exiles the volatile fluff to the easily discarded edges.
2916200	2919040	This has been a staggering intellectual projector.
2919080	2925000	We opened this deep dive examining a mundane, almost invisible grammatical quirk,
2925220	2930240	a mild sensation of friction when we heard wooden red small box.
2930440	2931180	It's a simple thing.
2931280	2935580	And from that tiny anomaly, we unpacked the cognitive physics of object permanence.
2935820	2941920	We explored the resource allocation strategies of the brain and the reachability gradients of future action.
2942020	2943160	We really covered some ground.
2943160	2946300	We dissected the foveal efficiency of the Arabic dot,
2946300	2949340	toggled the persistent styles of Spanish verbs,
2949340	2956900	and ultimately discovered that our daily syntax is a perfectly preserved artifact of ancient Aristotelian metaphysics.
2956900	2959720	We are speaking the structure of the universe.
2959720	2967480	It should permanently dismantle the notion that grammar is a collection of dry, arbitrary rules invented by academics to police our speech.
2967560	2971660	The syntax we utilize is a dynamic, highly optimized map of reality.
2972260	2977740	We obey these sequences precisely because they reflect the absolute truth of the physical world we are forced to navigate.
2977740	2984220	Which leaves me with one final, deeply provocative question for you, the listener, to carry with you today.
2984900	2997740	If this completely invisible, mundane grammatical rule is secretly a highly sophisticated mathematical equation designed by evolutionary pressure to map the universe and guarantee our survival,
2998580	2999720	what else is?
2999820	3000820	Oh, that's a good question.
3000820	3009560	Look at the arbitrary social norms you follow, the seemingly pointless daily habits you execute, the rigid cultural architectures you inhabit.
3010100	3016620	What other invisible laws are you blindly, perfectly executing right now, assuming they are just the way things are,
3016920	3022080	when in reality they are ancient high-stakes algorithms calculating your exact navigation of the future?
3022240	3027560	Once you realize the architecture is hiding in plain sight, you begin to see it in every aspect of human behavior.
3027560	3031420	You will certainly never look at a small red wooden box the same way again.
3031780	3035200	Thank you for venturing into the persistence hierarchy with us on this deep dive.
3035620	3039640	Keep questioning the invisible structures mapping your reality, and we will see you next time.
